{
  "v": "1.0",
  "id": "WO-2001",
  "alias": null,
  "goal": "Example: show a sunrise colour in the sky of the demo scene",
  "stream": "DEMO",
  "owner": "crew",
  "plan": "plans/example-plan.md#slice-2",
  "decision": "D-8",
  "repo": "example-owner/example-repo",
  "branch": "wo/2001-sunrise",
  "base": "main",
  "pr": "example#41",
  "stackParent": null,
  "stage": "docs",
  "state": "shipped",
  "blockedOn": null,
  "next": null,
  "ageH": 26.1,
  "stageAgeH": 3,
  "attempts": 1,
  "dod": {
    "change-note": "no",
    "tests": "yes",
    "names": "yes",
    "glossary": "n/a",
    "docs": "no",
    "map": "no"
  },
  "brief": "work/WO-2001/BRIEF.md",
  "report": null,
  "proof": "a1b2c3d4e5f60718293a4b5c6d7e8f9012345678",
  "lastSeq": 9
}
